number,value,datetime_start,datetime_complete,duration,params_depth,params_lam_tie,params_lr,params_mode,system_attrs_fixed_params,state
0,0.9736026397360263,2026-10-04 17:33:17.940642,2026-10-04 17:33:25.283360,0 days 00:00:07.342718,3,,0.05,hard,"{'lr': 0.05, 'mode': 'hard', 'depth': 3, 'lam_tie': 0.1}",COMPLETE
1,0.9729027097290271,2026-10-04 17:33:25.669661,2026-10-04 17:33:33.413615,0 days 00:00:07.743954,4,,0.028057582076672527,hard,,COMPLETE
2,0.9715028497150285,2026-10-04 17:33:33.764677,2026-10-04 17:33:40.238725,0 days 00:00:06.474048,6,,0.01025669131543725,hard,,COMPLETE
3,0.9699030096990301,2026-10-04 17:33:40.595263,2026-10-04 17:33:46.872313,0 days 00:00:06.277050,6,,0.07965261308120507,hard,,COMPLETE
4,,2026-10-04 17:33:47.231492,2026-10-04 17:33:47.340284,0 days 00:00:00.108792,2,,0.2311294500510414,hard,,PRUNED
5,0.9715028497150285,2026-10-04 17:33:47.705539,2026-10-04 17:33:52.469977,0 days 00:00:04.764438,3,,0.020298058052421523,hard,,COMPLETE
6,0.961003899610039,2026-10-04 17:33:52.830154,2026-10-04 17:33:55.247673,0 days 00:00:02.417519,3,0.06672367170464207,0.08369042894376064,soft,,PRUNED
7,0.9366063393660634,2026-10-04 17:33:55.583719,2026-10-04 17:33:58.510016,0 days 00:00:02.926297,4,0.0015339162591163618,0.18591820902866033,soft,,PRUNED
8,0.9504049595040496,2026-10-04 17:33:58.885149,2026-10-04 17:34:01.630693,0 days 00:00:02.745544,6,,0.08204643365323959,hard,,PRUNED
9,,2026-10-04 17:34:01.971816,2026-10-04 17:34:02.095930,0 days 00:00:00.124114,2,,0.42680949314334127,hard,,PRUNED
10,0.9568043195680432,2026-10-04 17:34:02.469810,2026-10-04 17:34:05.707348,0 days 00:00:03.237538,5,5.359957765771775,0.0067846335522190005,soft,,PRUNED
11,0.9712028797120288,2026-10-04 17:34:06.054275,2026-10-04 17:34:10.366380,0 days 00:00:04.312105,4,,0.02781875428614595,hard,,PRUNED
