number,value,datetime_start,datetime_complete,duration,params_l1,params_l2,params_lr,params_mode,params_scale_0,params_scale_1,params_scale_out,system_attrs_fixed_params,state
0,0.9765023497650235,2026-10-04 20:47:20.891523,2026-10-04 20:47:27.852940,0 days 00:00:06.961417,1e-07,1e-05,0.05,lsuv,,,,"{'lr': 0.05, 'l2': 1e-05, 'l1': 1e-07, 'mode': 'lsuv'}",COMPLETE
1,0.9731026897310269,2026-10-04 20:47:28.271686,2026-10-04 20:47:35.138092,0 days 00:00:06.866406,4.570563099801454e-06,0.005061576888752304,0.028057582076672527,search,0.30513623796136985,0.23406777359270511,2.0880081501089327,,COMPLETE
2,0.9778022197780222,2026-10-04 20:47:35.546389,2026-10-04 20:47:42.636000,0 days 00:00:07.089611,1.2674255898937224e-09,0.00017718847354806813,0.07965261308120507,search,0.35543498097189247,0.3272447970178924,0.32864757839415243,,COMPLETE
3,0.9763023697630236,2026-10-04 20:47:43.006383,2026-10-04 20:47:50.062435,0 days 00:00:07.056052,1.4445251022763057e-07,1.4077923139972383e-05,0.020298058052421523,lsuv,,,,,COMPLETE
4,0.9608039196080392,2026-10-04 20:47:50.437829,2026-10-04 20:47:53.088140,0 days 00:00:02.650311,6.789053271698485e-08,5.660670699258882e-07,0.009505122659935179,lsuv,,,,,PRUNED
5,0.9638036196380362,2026-10-04 20:47:53.470566,2026-10-04 20:47:56.183267,0 days 00:00:02.712701,9.163741808778782e-07,1.217325250419405e-05,0.01254057843022616,lsuv,,,,,PRUNED
6,0.9623037696230377,2026-10-04 20:47:56.580462,2026-10-04 20:47:59.696338,0 days 00:00:03.115876,5.551721685244724e-05,2.4564592152507462e-08,0.010965242778321846,search,0.45633479761632406,0.2605561420618056,1.2757056450498117,,PRUNED
7,0.9633036696330367,2026-10-04 20:48:00.095157,2026-10-04 20:48:02.986680,0 days 00:00:02.891523,2.991469302130218e-07,5.397956855996434e-08,0.037955524026413466,lsuv,,,,,PRUNED
8,0.9651034896510349,2026-10-04 20:48:03.389826,2026-10-04 20:48:06.136211,0 days 00:00:02.746385,3.618723330959625e-08,9.44351568796269e-05,0.01646379567211809,lsuv,,,,,PRUNED
9,0.9611038896110389,2026-10-04 20:48:06.518096,2026-10-04 20:48:09.753830,0 days 00:00:03.235734,7.510418138777553e-06,0.006569128640939186,0.011713290529102026,search,1.0097524940480989,2.4279415391108756,0.2541588599842737,,PRUNED
10,0.9434056594340566,2026-10-04 20:48:10.174641,2026-10-04 20:48:12.817552,0 days 00:00:02.642911,1.0907785690006127e-09,0.00038050318699936133,0.19949059617733575,search,2.20111466849178,0.6664152706878907,0.3195060606956541,,PRUNED
11,0.96000399960004,2026-10-04 20:48:13.228239,2026-10-04 20:48:16.107283,0 days 00:00:02.879044,1.066419503105837e-09,1.0204014271263356e-06,0.12328282112896286,search,0.20590300471135947,0.6494186401951444,0.5505664400413522,,PRUNED
