number,value,datetime_start,datetime_complete,duration,params_c2,params_l1,params_l2,params_restart,params_variant,system_attrs_fixed_params,state
0,0.9061093890610938,2026-10-04 20:35:10.342279,2026-10-04 20:35:19.388738,0 days 00:00:09.046459,0.1,1e-07,1e-05,50,PR+,"{'l2': 1e-05, 'l1': 1e-07, 'variant': 'PR+', 'restart': 50, 'c2': 0.1}",COMPLETE
1,0.9063093690630937,2026-10-04 20:35:20.002536,2026-10-04 20:35:29.965483,0 days 00:00:09.962947,0.1201975341512912,5.6698495114788556e-05,1.7670169402947916e-06,39,PR+,,COMPLETE
2,0.8921107889211078,2026-10-04 20:35:30.304583,2026-10-04 20:35:37.359817,0 days 00:00:07.055234,0.48645943347289744,2.142302175774106e-05,2.2310108018679158e-08,13,FR,,COMPLETE
3,0.901009899010099,2026-10-04 20:35:37.727846,2026-10-04 20:35:45.383277,0 days 00:00:07.655431,0.28614039423450705,1.1526449540315623e-08,0.0009877700294007926,68,FR,,COMPLETE
4,0.746025397460254,2026-10-04 20:35:45.747103,2026-10-04 20:35:49.237333,0 days 00:00:03.490230,0.2148628294821613,2.8585493941961944e-08,3.905441275210794e-06,65,PR+,,PRUNED
5,0.6403359664033597,2026-10-04 20:35:49.582214,2026-10-04 20:35:54.110626,0 days 00:00:04.528412,0.07090268572399898,8.431013932082473e-06,5.450293694558252e-06,123,FR,,PRUNED
6,0.2410758924107589,2026-10-04 20:35:54.473523,2026-10-04 20:35:56.700785,0 days 00:00:02.227262,0.4137788066524075,7.122305833333871e-09,4.418441521199721e-05,194,FR,,PRUNED
7,0.746025397460254,2026-10-04 20:35:57.043185,2026-10-04 20:36:00.564767,0 days 00:00:03.521582,0.2728296095500716,3.078651783619621e-09,6.724850206557239e-07,33,PR+,,PRUNED
8,0.3551644835516448,2026-10-04 20:36:00.913840,2026-10-04 20:36:03.408458,0 days 00:00:02.494618,0.28403060953001485,3.520481045526042e-05,1.6081669283634632e-08,69,FR,,PRUNED
9,0.26997300269973,2026-10-04 20:36:03.754921,2026-10-04 20:36:06.139636,0 days 00:00:02.384715,0.452672307692442,8.399864445957509e-09,1.906609163818844e-05,189,PR+,,PRUNED
10,0.8251174882511749,2026-10-04 20:36:06.494500,2026-10-04 20:36:11.251371,0 days 00:00:04.756871,0.17270909474048796,2.6395527207142433e-06,0.004686183228417076,115,PR+,,PRUNED
11,0.6166383361663834,2026-10-04 20:36:11.617099,2026-10-04 20:36:16.135860,0 days 00:00:04.518761,0.05324548556809515,2.5658289951246215e-07,6.359001659136988e-07,37,PR+,,PRUNED
