number,value,datetime_start,datetime_complete,duration,params_dist,params_l1,params_l2,params_lr,params_std,system_attrs_fixed_params,state
0,0.9761023897610239,2026-10-04 20:40:02.647587,2026-10-04 20:40:07.424519,0 days 00:00:04.776932,normal,1e-07,1e-05,0.05,0.05,"{'lr': 0.05, 'l2': 1e-05, 'l1': 1e-07, 'dist': 'normal', 'std': 0.05}",COMPLETE
1,0.9683031696830317,2026-10-04 20:40:07.776522,2026-10-04 20:40:12.575815,0 days 00:00:04.799293,normal,4.570563099801454e-06,0.005061576888752304,0.028057582076672527,0.0026364803038431655,,COMPLETE
2,0.8994100589941005,2026-10-04 20:40:12.922880,2026-10-04 20:40:17.459474,0 days 00:00:04.536594,normal,1.0129197956845748e-06,0.0015741890047456662,0.00653336961902664,0.41472250004816347,,COMPLETE
3,0.9475052494750525,2026-10-04 20:40:17.799291,2026-10-04 20:40:22.397222,0 days 00:00:04.597931,uniform,8.111941985431926e-09,1.879466824163843e-07,0.2311294500510414,0.026079656598095833,,COMPLETE
4,0.9786021397860214,2026-10-04 20:40:22.832464,2026-10-04 20:40:27.779633,0 days 00:00:04.947169,uniform,1.146210740342504e-06,5.589524205217922e-07,0.03654769917956455,0.009745399020374083,,COMPLETE
5,0.9701029897010299,2026-10-04 20:40:28.116472,2026-10-04 20:40:33.003542,0 days 00:00:04.887070,uniform,9.962513222055125e-09,0.0005141096648805752,0.040842279473800806,0.0013346527038305934,,COMPLETE
6,0.9454054594540546,2026-10-04 20:40:33.365525,2026-10-04 20:40:35.156353,0 days 00:00:01.790828,uniform,2.1147447960615697e-09,1.0547383621352015e-07,0.08204643365323959,0.15199881220083966,,PRUNED
7,0.977002299770023,2026-10-04 20:40:35.518416,2026-10-04 20:40:40.049813,0 days 00:00:04.531397,normal,2.6373339933815266e-06,3.855073690026179e-08,0.020332816567573974,0.021700394405050148,,COMPLETE
8,0.9337066293370663,2026-10-04 20:40:40.391758,2026-10-04 20:40:42.399811,0 days 00:00:02.008053,normal,1.967432802530612e-08,0.0028570800750407216,0.0058579686961535305,0.02533074654001447,,PRUNED
9,0.11238876112388761,2026-10-04 20:40:42.748481,2026-10-04 20:40:44.540528,0 days 00:00:01.792047,uniform,7.045683638454505e-05,1.2856617791467908e-07,0.06199983918423046,0.2600831268726488,,PRUNED
10,0.11238876112388761,2026-10-04 20:40:44.884965,2026-10-04 20:40:46.718401,0 days 00:00:01.833436,uniform,4.4388474527722084e-05,5.12971425417017e-06,0.38836769081185185,0.0054446968254086466,,PRUNED
11,0.9652034796520348,2026-10-04 20:40:47.087274,2026-10-04 20:40:49.823572,0 days 00:00:02.736298,normal,1.5483130563709917e-06,1.2404201083947842e-08,0.01729975246585754,0.009459032310939799,,PRUNED
