number,value,datetime_start,datetime_complete,duration,params_l1,params_l2,params_lr,params_precision_init,system_attrs_fixed_params,state
0,0.9602039796020398,2026-10-04 20:56:24.452870,2026-10-04 20:56:31.939077,0 days 00:00:07.486207,1e-07,1e-05,0.001,marginal,"{'lr': 0.001, 'l2': 1e-05, 'l1': 1e-07, 'precision_init': 'marginal'}",COMPLETE
1,0.9745025497450255,2026-10-04 20:56:32.316724,2026-10-04 20:56:39.366140,0 days 00:00:07.049416,4.570563099801454e-06,0.005061576888752304,0.0008468008575248334,one,,COMPLETE
2,0.9556044395560443,2026-10-04 20:56:39.757674,2026-10-04 20:56:46.967516,0 days 00:00:07.209842,2.142302175774106e-05,2.2310108018679158e-08,0.00024345423962016954,marginal,,COMPLETE
3,0.9172082791720828,2026-10-04 20:56:47.378611,2026-10-04 20:56:54.444979,0 days 00:00:07.066368,1.4528246637516043e-05,0.006598711072054081,0.00011245798259119348,one,,COMPLETE
4,0.9418058194180582,2026-10-04 20:56:54.876263,2026-10-04 20:56:58.998783,0 days 00:00:04.122520,4.2051564509138706e-07,6.690421166498788e-07,0.0002846526357761096,one,,PRUNED
5,0.11238876112388761,2026-10-04 20:56:59.373905,2026-10-04 20:57:02.413652,0 days 00:00:03.039747,2.8888383623653223e-08,6.870101665590006e-08,0.0032781876533976148,marginal,,PRUNED
6,0.11248875112488751,2026-10-04 20:57:02.787243,2026-10-04 20:57:05.545938,0 days 00:00:02.758695,3.725393839578888e-07,1.577766363058244e-07,0.008810003129071787,one,,PRUNED
7,0.11238876112388761,2026-10-04 20:57:05.937717,2026-10-04 20:57:08.665355,0 days 00:00:02.727638,2.1147447960615697e-09,1.0547383621352015e-07,0.0031986171822035612,marginal,,PRUNED
8,0.11238876112388761,2026-10-04 20:57:09.057935,2026-10-04 20:57:12.004604,0 days 00:00:02.946669,3.078651783619621e-09,6.724850206557239e-07,0.010057690178153982,one,,PRUNED
9,0.8922107789221078,2026-10-04 20:57:12.410915,2026-10-04 20:57:15.743917,0 days 00:00:03.333002,1.4857392806279254e-09,9.355380606452177e-06,0.00020058733363444964,one,,PRUNED
10,0.9745025497450255,2026-10-04 20:57:16.161377,2026-10-04 20:57:23.730918,0 days 00:00:07.569541,3.024050342772718e-06,0.003955232336089214,0.0008464942642835117,one,,COMPLETE
11,0.9743025697430256,2026-10-04 20:57:24.203361,2026-10-04 20:57:32.060924,0 days 00:00:07.857563,2.883745233291565e-06,0.002792471643386222,0.0008378823732990562,one,,COMPLETE
