number,value,datetime_start,datetime_complete,duration,params_lam,params_lr,params_source,system_attrs_fixed_params,state
0,0.9753024697530247,2026-10-04 17:41:05.226189,2026-10-04 17:41:27.981465,0 days 00:00:22.755276,0.1,0.05,affine,"{'lr': 0.05, 'lam': 0.1, 'source': 'affine'}",COMPLETE
1,0.9781021897810219,2026-10-04 17:41:28.321817,2026-10-04 17:41:49.180599,0 days 00:00:20.858782,2.0218499516556734,0.028057582076672527,affine,,COMPLETE
2,0.9736026397360263,2026-10-04 17:41:49.516703,2026-10-04 17:42:21.651875,0 days 00:00:32.135172,0.003486678167045121,0.01025669131543725,manifold,,COMPLETE
3,0.9736026397360263,2026-10-04 17:42:21.998325,2026-10-04 17:42:54.611401,0 days 00:00:32.613076,0.2897705266717828,0.07965261308120507,manifold,,COMPLETE
4,0.11308869113088692,2026-10-04 17:42:54.968606,2026-10-04 17:43:07.983232,0 days 00:00:13.014626,0.005474303040596575,0.2311294500510414,manifold,,PRUNED
5,0.9757024297570243,2026-10-04 17:43:08.355289,2026-10-04 17:43:29.221316,0 days 00:00:20.866027,0.06677928149251665,0.020298058052421523,affine,,COMPLETE
6,0.961003899610039,2026-10-04 17:43:29.572258,2026-10-04 17:43:42.487517,0 days 00:00:12.915259,0.0030551818670802623,0.08369042894376064,manifold,,PRUNED
7,0.9766023397660234,2026-10-04 17:43:42.872123,2026-10-04 17:44:15.804174,0 days 00:00:32.932051,0.5372198163554894,0.040842279473800806,manifold,,COMPLETE
8,0.9622037796220378,2026-10-04 17:44:16.168132,2026-10-04 17:44:24.591280,0 days 00:00:08.423148,0.0014504865877614263,0.0765242606091573,affine,,PRUNED
9,0.9547045295470453,2026-10-04 17:44:24.935314,2026-10-04 17:44:33.447828,0 days 00:00:08.512514,1.9924621034349888,0.006746417134006626,affine,,PRUNED
10,0.1126887311268873,2026-10-04 17:44:33.802258,2026-10-04 17:44:42.043329,0 days 00:00:08.241071,1.752565619290386,0.38836769081185185,affine,,PRUNED
11,0.9636036396360363,2026-10-04 17:44:42.411580,2026-10-04 17:44:55.497428,0 days 00:00:13.085848,0.549935041497652,0.024698568747835502,manifold,,PRUNED
