number,value,datetime_start,datetime_complete,duration,params_activation,params_l1,params_l2,params_lr,system_attrs_fixed_params,state
0,0.9772022797720228,2026-10-04 21:07:34.716804,2026-10-04 21:07:39.931803,0 days 00:00:05.214999,relu,1e-07,1e-05,0.05,"{'lr': 0.05, 'l2': 1e-05, 'l1': 1e-07, 'activation': 'relu'}",COMPLETE
1,0.968003199680032,2026-10-04 21:07:40.287229,2026-10-04 21:07:45.023917,0 days 00:00:04.736688,tanh,4.570563099801454e-06,0.005061576888752304,0.028057582076672527,,COMPLETE
2,0.9638036196380362,2026-10-04 21:07:45.375516,2026-10-04 21:07:50.174732,0 days 00:00:04.799216,relu,7.072114131472238e-05,1.328944872286916e-08,0.1303512379185383,,COMPLETE
3,0.9756024397560243,2026-10-04 21:07:50.531389,2026-10-04 21:07:55.124818,0 days 00:00:04.593429,tanh,1.146210740342504e-06,5.589524205217922e-07,0.03654769917956455,,COMPLETE
4,0.9756024397560243,2026-10-04 21:07:55.475605,2026-10-04 21:08:00.803095,0 days 00:00:05.327490,tanh,1.7070728830306632e-09,3.5849855803404713e-05,0.053387413547406753,,COMPLETE
5,0.9664033596640336,2026-10-04 21:08:01.145736,2026-10-04 21:08:04.237725,0 days 00:00:03.091989,tanh,2.6373339933815266e-06,3.855073690026179e-08,0.020332816567573974,,PRUNED
6,0.9552044795520448,2026-10-04 21:08:04.656524,2026-10-04 21:08:15.331098,0 days 00:00:10.674574,elu,3.9841905944346867e-07,7.417652034871823e-07,0.10568529720322861,,PRUNED
7,0.9102089791020898,2026-10-04 21:08:15.727893,2026-10-04 21:08:18.232293,0 days 00:00:02.504400,sigmoid,2.769889922756283e-09,0.0033981724150106006,0.0784819819433057,,PRUNED
8,0.9691030896910309,2026-10-04 21:08:18.615653,2026-10-04 21:08:24.334920,0 days 00:00:05.719267,maxout,5.169879442298541e-07,4.848496183873288e-07,0.02585095893183496,,PRUNED
9,0.8794120587941205,2026-10-04 21:08:24.726119,2026-10-04 21:08:26.895568,0 days 00:00:02.169449,sigmoid,3.4220529032706937e-06,0.0007812113973534924,0.005128781987092828,,PRUNED
10,0.1166883311668833,2026-10-04 21:08:27.273662,2026-10-04 21:08:29.341636,0 days 00:00:02.067974,relu,3.2579669126491025e-08,4.0424464720357144e-05,0.38836769081185185,,PRUNED
11,0.956004399560044,2026-10-04 21:08:29.720082,2026-10-04 21:08:31.940184,0 days 00:00:02.220102,leaky_relu,2.5422264441956258e-08,1.7332772867549105e-06,0.00790760495467862,,PRUNED
