number,value,datetime_start,datetime_complete,duration,params_d,params_final_frac,params_gamma,params_l1,params_l2,params_lr,params_schedule,params_step_epochs,params_tau_frac,system_attrs_fixed_params,state
0,0.9558044195580442,2026-10-04 20:25:33.163030,2026-10-04 20:25:37.701291,0 days 00:00:04.538261,,0.01,,1e-07,1e-05,0.05,linear,,0.8,"{'lr': 0.05, 'l2': 1e-05, 'l1': 1e-07, 'schedule': 'linear', 'tau_frac': 0.8, 'final_frac': 0.01}",COMPLETE
1,0.9463053694630537,2026-10-04 20:25:38.070798,2026-10-04 20:25:42.914848,0 days 00:00:04.844050,,0.030834348179355788,,4.570563099801454e-06,0.005061576888752304,0.028057582076672527,linear,,0.9063233020424546,,COMPLETE
2,0.9656034396560343,2026-10-04 20:25:43.254593,2026-10-04 20:25:48.449302,0 days 00:00:05.194709,,0.0199473547030745,,7.072114131472238e-05,1.328944872286916e-08,0.1303512379185383,linear,,0.5129695700716763,,COMPLETE
3,0.9646035396460354,2026-10-04 20:25:48.801973,2026-10-04 20:25:53.886943,0 days 00:00:05.084970,,,,1.146210740342504e-06,5.589524205217922e-07,0.03654769917956455,step,8.0,,,COMPLETE
4,0.9244075592440756,2026-10-04 20:25:54.233735,2026-10-04 20:25:56.215243,0 days 00:00:01.981508,,,0.9751768058034667,9.163741808778782e-07,1.217325250419405e-05,0.01254057843022616,exponential,,,,PRUNED
5,0.9694030596940306,2026-10-04 20:25:56.549458,2026-10-04 20:26:00.638200,0 days 00:00:04.088742,,,0.8436013039322683,3.33479272863759e-08,0.0007085721663941599,0.42680949314334127,exponential,,,,COMPLETE
6,0.8923107689231077,2026-10-04 20:26:00.961543,2026-10-04 20:26:02.715554,0 days 00:00:01.754011,,0.25221951700214285,,1.967432802530612e-08,0.0028570800750407216,0.0058579686961535305,linear,,0.42939811886786894,,PRUNED
7,0.9693030696930307,2026-10-04 20:26:03.046915,2026-10-04 20:26:08.046266,0 days 00:00:04.999351,,,0.713115913784056,2.9794544625913642e-05,0.004335045392775138,0.1775152429064153,exponential,,,,COMPLETE
8,0.9263073692630737,2026-10-04 20:26:08.398262,2026-10-04 20:26:10.180426,0 days 00:00:01.782164,,0.09708210658008556,,2.27376281025369e-08,2.148145718198268e-06,0.02236818087310632,linear,,0.3986469574823338,,PRUNED
9,0.8956104389561044,2026-10-04 20:26:10.521266,2026-10-04 20:26:12.150064,0 days 00:00:01.628798,0.7360091638366143,,,7.2648030748267374e-06,0.00834298801304736,0.007048087574907934,inverse,,,,PRUNED
10,0.969003099690031,2026-10-04 20:26:12.481948,2026-10-04 20:26:16.749620,0 days 00:00:04.267672,,,0.8424846899585681,1.0907785690006127e-09,0.00021363875978487205,0.454953098148465,exponential,,,,COMPLETE
11,0.9743025697430256,2026-10-04 20:26:17.085679,2026-10-04 20:26:21.133582,0 days 00:00:04.047903,,,0.7019510372888542,6.665148427358314e-05,0.0002742449534924103,0.3268132041482867,exponential,,,,COMPLETE
