number,value,datetime_start,datetime_complete,duration,params_l1,params_l2,params_lr,params_pre_frac,params_pre_lr,params_task,system_attrs_fixed_params,state
0,0.9754024597540246,2026-10-04 20:59:00.584666,2026-10-04 20:59:03.781498,0 days 00:00:03.196832,1e-07,1e-05,0.05,0.3,0.05,related,"{'lr': 0.05, 'l2': 1e-05, 'l1': 1e-07, 'task': 'related', 'pre_frac': 0.3, 'pre_lr': 0.05}",COMPLETE
1,0.9649035096490352,2026-10-04 20:59:04.125084,2026-10-04 20:59:08.506765,0 days 00:00:04.381681,4.570563099801454e-06,0.005061576888752304,0.028057582076672527,0.17799726016810133,0.006194745024628934,related,,COMPLETE
2,0.11228877112288771,2026-10-04 20:59:08.852561,2026-10-04 20:59:11.929571,0 days 00:00:03.077010,3.470266988650418e-06,4.0428727350273306e-05,0.2699742204893715,0.5162213204002108,0.010943342660062645,unrelated,,COMPLETE
3,0.973002699730027,2026-10-04 20:59:12.270639,2026-10-04 20:59:15.963045,0 days 00:00:03.692406,3.3205591037519614e-08,1.2601639723276798e-07,0.011551009439226469,0.24561457009902096,0.04777437867054351,related,,COMPLETE
4,0.9559044095590441,2026-10-04 20:59:16.311526,2026-10-04 20:59:18.642058,0 days 00:00:02.330532,6.789053271698485e-08,5.660670699258882e-07,0.009505122659935179,0.19983689107917987,0.03332762947392949,unrelated,,PRUNED
5,0.9188081191880811,2026-10-04 20:59:18.977423,2026-10-04 20:59:21.792488,0 days 00:00:02.815065,1.0907475835157712e-06,1.8997763474111273e-08,0.0765242606091573,0.5744427686266667,0.17618561667189314,related,,PRUNED
6,0.9388061193880612,2026-10-04 20:59:22.131025,2026-10-04 20:59:24.166364,0 days 00:00:02.035339,3.078651783619621e-09,6.724850206557239e-07,0.20690200562805067,0.16101911742238942,0.031065126086242026,related,,PRUNED
7,0.9707029297070293,2026-10-04 20:59:24.529271,2026-10-04 20:59:28.015076,0 days 00:00:03.485805,1.967432802530612e-08,0.0028570800750407216,0.0058579686961535305,0.3600340105889054,0.03756926249576086,related,,COMPLETE
8,0.11238876112388761,2026-10-04 20:59:28.361914,2026-10-04 20:59:30.825720,0 days 00:00:02.463806,7.510418138777553e-06,0.006569128640939186,0.011713290529102026,0.3989499894055426,0.14992285132527539,related,,PRUNED
9,0.926007399260074,2026-10-04 20:59:31.165013,2026-10-04 20:59:33.232211,0 days 00:00:02.067198,1.6832027985721926e-09,1.499329805509153e-07,0.007515450322528414,0.23567451588694796,0.10633034207853799,unrelated,,PRUNED
10,0.9594040595940406,2026-10-04 20:59:33.565398,2026-10-04 20:59:36.116402,0 days 00:00:02.551004,7.041830285016006e-05,4.0424464720357144e-05,0.06818350658071964,0.43432518221364985,0.01515279968860738,unrelated,,PRUNED
11,0.9758024197580242,2026-10-04 20:59:36.456975,2026-10-04 20:59:40.676814,0 days 00:00:04.219839,1.5965632314170815e-07,3.6146501477851745e-06,0.02699657592452432,0.28324780472035305,0.06544185131336379,related,,COMPLETE
